{
  "schema": "snapforge.layout/v1",
  "surface": {
    "kind": "screen",
    "name": "SettingsScreen"
  },
  "nodes": [
    {
      "role": "heading",
      "text": "Settings",
      "conf": 0.96,
      "bbox": [
        0.05,
        0.04,
        0.45,
        0.1
      ]
    },
    {
      "role": "container",
      "variant": "card",
      "pad": 0.042,
      "radius": "md",
      "conf": 0.94,
      "bbox": [
        0.05,
        0.14,
        0.95,
        0.72
      ],
      "children": [
        {
          "role": "row",
          "label": "Push notifications",
          "ctrl": "switch",
          "state": "on",
          "conf": 0.91
        },
        {
          "role": "row",
          "label": "Volume",
          "ctrl": "slider",
          "value": 0.6,
          "conf": 0.89
        }
      ]
    },
    {
      "role": "button",
      "variant": "primary",
      "text": "Save changes",
      "conf": 0.97,
      "bbox": [
        0.15,
        0.78,
        0.85,
        0.88
      ]
    }
  ],
  "unresolved": [
    {
      "bbox": [
        0.7,
        0.04,
        0.93,
        0.12
      ],
      "reason": "illegible_handwriting"
    }
  ]
}