{
  "schema": "snapforge.layout/v1",
  "surface": {
    "kind": "component",
    "name": "NavDrawer"
  },
  "nodes": [
    {
      "role": "container",
      "variant": "panel",
      "conf": 0.9,
      "children": [
        {
          "role": "list",
          "conf": 0.9,
          "children": [
            {
              "role": "row",
              "label": "Inbox",
              "conf": 0.9
            },
            {
              "role": "row",
              "label": "Outbox",
              "conf": 0.9
            },
            {
              "role": "divider",
              "conf": 0.9
            },
            {
              "role": "row",
              "label": "Spam",
              "conf": 0.9
            }
          ]
        }
      ]
    }
  ],
  "unresolved": []
}