{
  "schema": "snapforge.layout/v1",
  "surface": {
    "kind": "component",
    "name": "EmptyState"
  },
  "nodes": [
    {
      "role": "column",
      "conf": 0.9,
      "children": [
        {
          "role": "icon",
          "text": "inbox",
          "conf": 0.9
        },
        {
          "role": "heading",
          "text": "No messages",
          "conf": 0.9
        },
        {
          "role": "text",
          "text": "Check back later",
          "conf": 0.9
        }
      ]
    }
  ],
  "unresolved": []
}